Entry,User,EntryDates,EntryLinks
hissetmedim çok ilginç. 99 depremi'ni de çok fazla hissetmiştim. bu da çok ilginç. ortası yok galiba.,reactionary,16.11.2015 22:47,https://eksisozluk.com/entry/56298346
kira kontratında bile kaç yıl önce yapıldığı yazmayan apartmana girmek yerine kampüsteki sütiş'te sabahlamamı sağlayan -şimdilik kararım bu- hissetmediğim ama korkutan sallantıdır :s,ahlaksiz ve sorumsuz oduncu cocugu,16.11.2015 22:50,https://eksisozluk.com/entry/56298440
geldi yine tipini .iktigim,illegalsincap,16.11.2015 23:31,https://eksisozluk.com/entry/56299558
levent ve civarlarında pek hissedilmemiş depremdir,mutatismutandis,16.11.2015 23:46,https://eksisozluk.com/entry/56299983
(bkz: 7.9 istanbul depremi artçısı ),juve06ntus,16.11.2015 23:46,https://eksisozluk.com/entry/56299986
büyük depremin provası olmuştur. hissettiğiniz şiddete göre ne kadar riskli bir bölgede olduğunuzu değerlendirin.,bu ne dunya kardesimmm,17.11.2015 00:29,https://eksisozluk.com/entry/56301183
"istanbulu hafif hafif sallamaya devam eden depremdir. uzun zamandır marmara bu kadar hareketli olmamıştı. umarım küçük küçük atar da enerjisini, başımıza iş açmaz.",zeplin7,17.11.2015 00:47,https://eksisozluk.com/entry/56301623
https://vine.co/v/o1jv2uzvx35,the gunners,17.11.2015 00:48,https://eksisozluk.com/entry/56301653
ölmedik be millet abartmayalım lütfen,imhereforyears,17.11.2015 00:50,https://eksisozluk.com/entry/56301690
doğal bir şey. yeryüzü katmanı yavaş yavaş oturuyor,neccarr,17.11.2015 01:06,https://eksisozluk.com/entry/56302004
kimse balkondan falan atlamadı ise ölenin olmayacağı depremdir.,lonelyfate,17.11.2015 01:07,https://eksisozluk.com/entry/56302019
"merkezi marmara denizi/yakuplu açıkları olan depremdir. sallamış, titretmiş ve bize kendini tekrar hatirlatmıştır.",yujnirayon,17.11.2015 02:09,https://eksisozluk.com/entry/56302923
"dersteyken hissetmediğim deprem. yanımda oturan arkadaş deprem oldu dedi, ben de yok ben ayağımı sallıyorum dedim, o da yok oldu oldu dedi ama sallanıyor mu diye bakacak bir avize olmadığından emin olamadık, kandillinin siteye girmeye çalıştık telefon sınıftan iyi çekmediği için o da yalan oldu, sonra ders çıkışı ben yemekhaneye arkadaşım evine giderken aradı beni olmuş diye. sonuca gelecek olursak; olacak arkadaşlar. bu son kaçınılmaz. yok ufak ufak sallasın da enerjiyi alsın falan hikaye. enerji olarak 4.0 ile 5.0 büyüklüklerindeki depremler arasında 33 kat fark var. yani 33 tane bunun gibi olsa bi 5lik eder. biz burada 7 civarı bekliyoruz. yani 36000 civarı olsa anca alır enerjiyi ki bu da imkansız. depremle yaşamayı öğrenmemiz lazım. bugün olmazsa yarın, yarın olmazsa seneye olacak. yarın (yani bugün) saat 14.30da yıldız teknik üniversitesi, davutpaşa kampüsü inşaat fakültesi konferans salonunda deprem konusunda farkındalık yaratmak ve bilinçlendirmek amaçlı bir sunum olacak. pek yolunuzun düşeceği bir yer değil ama geçerken uğramak isteyenleri bekleriz.",kim mi kardashian,17.11.2015 02:25,https://eksisozluk.com/entry/56303069
"hala daha sallanmaya devam etmekteyiz deprem m 3.2 ıstanbul, avcilar ilce merkezinin 16km guneyinde 06:36 (bkz: https://t.co/vriq78t6ge )",scuddy,17.11.2015 06:54,https://eksisozluk.com/entry/56304244
"şimdi yeşilköyde beni de salladı o ayrı da, deprem esnasında deprem entarisi yazan arkadaşa selam olsun, kendisi savaş muhabiri olmalı...",arrethius,17.11.2015 08:21,https://eksisozluk.com/entry/56304671
"evin sağlam olda ne olur, istanbulda hayat işte okulda trafikte ve kafeteryalarda geçiyor sonuç olarar, her yer saglam olmalı",lelelesakile,17.11.2015 08:44,https://eksisozluk.com/entry/56304902
4. levent içindeki evdeyken sallamış depremdir. sandalyede otururken birden sallanmış ardından masa oynatmıştır. bu kadar hissedilmesi evin kağıt olduğunu mu gösterir yoksa normal midir bilemediğim korkutan deprem.,necrolyte,17.11.2015 09:44,https://eksisozluk.com/entry/56305749
kartal da ofiste çalışırken hissettirmiş depremdir. avizelere baktım sallanmadı (ilginç!) bende umursamadım başım döndü herhalde diye ama sallamış cidden.,azi karar cogu zarar misali,17.11.2015 09:57,https://eksisozluk.com/entry/56305962
"titre kendine gel, dedirtmiştir",the serijon,17.11.2015 10:09,https://eksisozluk.com/entry/56306174
hissetmedigim depremdir.,panth purgas,17.11.2015 17:20,https://eksisozluk.com/entry/56314649
(bkz: 5 şubat 2014 istanbul depremi/@ventolin ),ventolin,18.11.2015 11:21,https://eksisozluk.com/entry/56330409
