Entry,User,EntryDates,EntryLinks
"deprem yaristiranlari gordugumuz basliktir. kardesim olmus olanin degeri mi dusuyor biz korkumuzu endisemizi paylasinca. 17 agustos depremi ki allah tekrarini yasatmasin, tabii ki bizim tahmin edemeyecegimiz bi felaketti fakat insan yataginda uzanirken bi anda sallaninca sasiriyor. devasa buyuklukte bi alan yer kure kaynakli sarsiliyor lan daha dehsetengiz bisiy olabilir mi. ustelik ankara da deprem bolgesi degil denmesine rahmen 3 tarafinda fay zone var. allah yasatmasin ama illa 7 buyuklugunde olup binlerce kisinin hayatini kaybetmesi mi lazim bizim korkmamiz sizin ise gecmis olsun demeniz icin. etmeyin. hastalik felaket dert yaristirmayin artik. kaldi ki ben yalovada da 7 sene yasamis biriyim. deprem gercekten psikoloji bozar. boyle davranmayin kimseye. yok ilik gotunuzu sikim ne kadar narinsiniz yok 3.5 da deprem mi falan. ne isterdin csnim kardesim 8 mi olsaydi. 8 olsa buraya mi yazardi adam. bu kadar geriyorsa seni bu baslik okuma. seyma subasinin story basligi var bak onu oku.",cemal sureya,20.08.2019 23:40,https://eksisozluk.com/entry/94217463
hafif salladı ama korkuttu açıkcası. artçı şokların sayısı yükseliyor. inşallah bu gelen daha büyük depremlerin habercisi değildir.,insanuzmani,20.08.2019 23:40,https://eksisozluk.com/entry/94217473
aslında yüksek hissedilmesine sebep olan bir konu da kayaç zeminde alçak yapılarda bulunmak. alüvyon zeminde yüksek bina öz salınımı ya da tam tersi durumda sağlam zeminde alçak bina öz salınımı risk oluşturur. (bkz: rezonans ),bulunmaz hint keneviri,20.08.2019 23:42,https://eksisozluk.com/entry/94217556
uyandırdı. baya da sarstı üstelik ama 2 saniye filan sürünce ben dedim yoldan kamyon filan geçti heralde. az önce kazanda tekrar deprem olmuş hadi bakalım demet akalın,cossackbey,20.08.2019 23:42,https://eksisozluk.com/entry/94217568
3.4 ile böyle kıçınız başınız oynadıysa ben istanbulda 7 olduğunda ne bok yiyeceğimizi düşünemiyorum.,tanerow123,20.08.2019 23:42,https://eksisozluk.com/entry/94217589
"tam da 17 ağustos depremini yaşadığımız için minik bir sarsıntıda bile aklımız başımızdan gidiyor olabilir mi acaba? o tarihte lise 1. sınıfa başlamıştım, taşınacaktık ve uyanıktık. hatta annemle yeni evin perdelerini ütülüyorduk. tek bir saniyesini atlamadan yaşadım. bugün alttan gelen sarsıntı ve o iki saniye, 45 saniyenin ne kadar uzun olabileceğini hatırlattı bana. kimseden haber alamamanın, günlerce eve girememenin ne olduğunu hatırlattı. büyük depremi yaşayıp sağ kalanlardan kimsenin ankara'da olmadığını sanmayın.",budevirdenicknegezer,20.08.2019 23:56,https://eksisozluk.com/entry/94218322
ben keçiören’deyim ne mamak ne de kazan depremini hissetmedim bizim zemin kayalık ondan sanırım.,ankara 1995,20.08.2019 23:56,https://eksisozluk.com/entry/94218324
depremi bilmeyen ankaralıları korkutmuş sarsıntıdır. 3.5'miş. daha kötüsünü marmara depreminde televizyondan da olsa görmüş ve yakın zamanda da yaşamış biri olarak allah beterinden korusun diyorum. tüm ankaralılara geçmiş olsun.,mintiminti1,21.08.2019 00:12,https://eksisozluk.com/entry/94219274
"depremi bilmeyen ankaralı yoktur. zira yakın çevresinde nerede deprem olursa mutlaka sallamıştır buraları da. düzce gibi, gölcük gibi. hadi onu geçtim burada yaşayan insanlar son zamanlarda patlama seslerine ve irkintilerine bağışıklık kazanmaya çalışıyor. o yüzden gürültülü olan her şey insanlar üzerinde tedirginlik ve endişe yaratıyor. mazur görün ak 3.5 olan depremde bile afalladık.",ekb88,21.08.2019 00:15,https://eksisozluk.com/entry/94219464
"hükümete uyarıdır. şimdi sıra, 7.4 yetmedi mi diyen kalleşlerin uyarılma sırasıdır. allah tüm belalardan halkımızı korusun inşallah.",romantik maco,21.08.2019 01:05,https://eksisozluk.com/entry/94221934
sabah olanı hissetmediğim ancak akşam olanı uykumdan uyandıran deprem. çok salladı.,the girl with the yellow umbrella,21.08.2019 01:18 ~ 02:34,https://eksisozluk.com/entry/94222447
"yine deprem olmuş biz yine sallanmadık ,ekşiyi açınca öğrendim .sanırım ben ankarada oturmuyorum veya bizim semte deprem uğramıyor",tefnut,21.08.2019 01:19,https://eksisozluk.com/entry/94222484
herkese geçmiş olsun dedirten depremdir. bu sıralar yurdun çeşitli yerlerinde yoklayıp duruyor. umarım daha kötüsünü tecrübe etmeyiz.,600f,21.08.2019 01:39,https://eksisozluk.com/entry/94223274
hakkında bu kadar entry girilmesi belirtildiği gibi özellikle eryaman'da oldukça şiddetli hissedilmesidir. 3.4 olduğunu görünce ben de anlam veremedim. zira 3.4 değil gibiydi. binadan mıdır? nedirdir?,l i o n,21.08.2019 01:52,https://eksisozluk.com/entry/94223702
deprem bile kıyaslar olmuşuz artık. yok efendim başka yerlerde hep oluyormuş. hiç bir yerde olmasın deprem. aferin sizin deprem daha büyükmüş falan dememizi mi bekliyorsun? başka şehirlerde bombalar patladığında ankaralılar da bizde hep patlıyor falan mı deselerdi? ruh hastası mısınız? deprem yarıştırıyorlar adamlara bak. küçüğü büyüğü farketmez ne depremi ne bombayı allah hiç bir şehre bir daha yaşatmasın.,ben oldum cinayet,21.08.2019 02:29 ~ 02:35,https://eksisozluk.com/entry/94224766
"kızımla boğuşurken koltuğun hareket ettiğini hissettim. yalnız ilginç bir şekilde avizeler milim sallanmadı . yanlis hissettim herhalde diye düşünürken haberlerde gördüm. her depremde, ben bunu hissettim ancak bu deprem uzaktaysa yıkıcı olmuştur hissi oluşuyor. 17 ağustostan kalma.",pathaamax,21.08.2019 07:10,https://eksisozluk.com/entry/94227635
"sabah olan depremi küçümsemiştim. mamak tarafında ve sabah olduğu için hissetmediğim bir deprem için ""bu ne ya. deprem mi ufacık bir şey olmuş. haber yapmışlar"" demiştim. ancak akşam eryamanda idim. malum deprem noktasına en yakın yerleşim. çay içiyorduk ve bildiğin sallandık. başta bir eşya falan sandım ama 4 kişi aniden sustuk, korktuk ve gerildik. en kötü kısmı çaresizliği hissettik. duvara araba ile çarpsan titremeyecek bina sallandı baya baya. o yüzden depremin şiddetini ve hissiyatını küçümsediğimi düşündüm. özür dilerim mamaklılar :) umarım bir daha yaşanmaz. son zamanlarda malum çok olmaya başladı depremler.",duygu mazosisti,21.08.2019 09:14,https://eksisozluk.com/entry/94229618
eryaman’da olup da hissetmediğim depremdir. evdeki eşyalardan çıtırtılar geldi ama cin falandır deyip pek önemsememiştim.,bin uccuz on iki,21.08.2019 09:23,https://eksisozluk.com/entry/94229867
yüksel caddesinde çay içiyordum . açık havada olan kafelerden kapalı değil. güm diye bir ses duyuldu . tüp patlaması gibi ya da çocuklar poşet şişirirler de patlatırlar ya öyle. birden yürüyen insanlar cadde yönünden ters tarafa koşuşmaya başladılar . kafede oturanlar çantaları alıp telaşla kalkıp ne yapacaklarını şaşırdılar. ben oturduğum yere insanlardaki telaşı görünce çakılıp kaldım. neyse bir kaç dakika sonra herkes ne oldu diye birbirlerine bakmaya başladılar. garson dışarıyı kontrol edip geldi. ne oldu diye sordum . o da şaşkın. insanların psikolojileri bozulmuş ankara da. ses ani gürültü vs kaldıramaz olmuşlar. kolay değil gözlerinin önünde benim bildiğim 4 kez merkezi yerde bomba patlatıldı. son 3 ü aynı yerlerde ve sık aralıklarla. bir de sonik ses mi diyorlar savaş uçaklarının yaptığı ses işte o ses tüm ankara da adeta bomba sesi gibi olmuştu. o gün herkesin yüzü bir anda bembeyaz olmuştu. ankaralı nın telaşı ile dalga geçmeyiniz. psikolojik bir savaş veriyorlar. tanrı acı göstermesin.,mada,22.08.2019 23:00 ~ 23.08.2019 17:46,https://eksisozluk.com/entry/94309338
